{
  "$schema": "https://json-schema.org/draft/2020-12/schema",
  "title": "Editorial Gauntlet Review",
  "type": "object",
  "additionalProperties": false,
  "required": [
    "decision",
    "coverage",
    "criteria",
    "hard_failures",
    "feedback",
    "artifact"
  ],
  "properties": {
    "decision": {
      "type": "string",
      "enum": ["approved", "feedback"]
    },
    "coverage": {
      "type": "number",
      "minimum": 0,
      "maximum": 1,
      "description": "Acceptance gate passes at coverage >= 0.99."
    },
    "criteria": {
      "type": "object",
      "minProperties": 14,
      "maxProperties": 14,
      "propertyNames": {
        "enum": [
          "clareza",
          "força da abertura",
          "originalidade",
          "credibilidade",
          "uso de evidências",
          "risco de alucinação",
          "tom humano",
          "densidade",
          "relevância",
          "consistência com a voz do autor",
          "estrutura obrigatória",
          "pergunta final",
          "tamanho editorial",
          "rastreabilidade das fontes"
        ]
      },
      "additionalProperties": {
        "type": "number",
        "minimum": 0,
        "maximum": 10
      }
    },
    "hard_failures": {
      "type": "array",
      "description": "Any hard failure or unresolved critical question blocks approval.",
      "items": {"type": "string"}
    },
    "feedback": {
      "type": "array",
      "items": {
        "type": "object",
        "additionalProperties": false,
        "required": ["criterion", "message"],
        "properties": {
          "criterion": {"type": "string", "minLength": 1},
          "message": {"type": "string", "minLength": 1}
        }
      }
    },
    "artifact": {
      "type": "string",
      "minLength": 1,
      "pattern": "^(?!/)(?!~)(?![A-Za-z]:)(?!.*\\\\)(?!.*(^|/)\\.\\.?(/|$)).+"
    },
    "evidence": {
      "type": "object",
      "additionalProperties": false,
      "required": ["context", "causal_chain", "decision", "consequence", "limits", "anchors"],
      "properties": {
        "context": {"type": "string", "minLength": 1},
        "causal_chain": {"type": "string", "minLength": 1},
        "decision": {"type": "string", "minLength": 1},
        "consequence": {"type": "string", "minLength": 1},
        "limits": {"type": "string", "minLength": 1},
        "anchors": {"type": "array", "minItems": 1, "items": {"type": "string", "minLength": 1}}
      }
    }
  }
}
